{
  "format": 1,
  "id": "ep02",
  "nomor": 2,
  "judul": "Transferan Nyasar",
  "pov": "Raka",
  "meta": {
    "teaser": "Pembeli yang kasar salah transfer Rp2,5 juta untuk sepatu Rp250 ribu. Dia tidak sadar. Kos jatuh tempo malam ini.",
    "sampul": "Seminggu setelah tangkapan layar itu. Bu Kos menagih, saldo tinggal Rp380.000, dan seorang pembeli yang menyebalkan baru saja salah ketik satu nol.",
    "durasi_menit": 7,
    "rating": "17+",
    "refleksi": "Kapan terakhir kali kamu mendapat sesuatu yang bukan hakmu, dan tidak ada yang tahu?",
    "bagikan": "Pembeli yang kasar salah transfer Rp2,5 juta buat sepatu Rp250 ribu. Dia ga sadar. Kos lu jatuh tempo malam ini.\n\nLu bakal gimana?\nPakai dulu · Balikin semua · Balikin sebagian\n\nQissa, Episode 2: Transferan Nyasar",
    "berikutnya": null
  },
  "vars": [
    "dipakai",
    "sebagian"
  ],
  "start": "pembuka",
  "knots": {
    "pembuka": [
      {
        "t": "view",
        "name": "Bu Kos",
        "initial": "B",
        "sub": "online",
        "pill": "Chat dengan Bu Kos",
        "group": false
      },
      {
        "t": "nar",
        "text": "Senin, 19.20. Seminggu setelah tangkapan layar itu. Kamar kos, kardus sepatu belum dibungkus."
      },
      {
        "t": "in",
        "text": "Mas Raka, kos bulan ini ya. Sudah tanggal 5."
      },
      {
        "t": "in",
        "text": "1.200.000 seperti biasa. Transfer saja."
      },
      {
        "t": "out",
        "text": "Siap Bu, malam ini saya usahakan"
      },
      {
        "t": "nar",
        "text": "Saldo: Rp380.000. Uang jualan minggu lalu seharusnya cukup. Seharusnya."
      },
      {
        "t": "view",
        "name": "Dion",
        "initial": "D",
        "sub": "pembeli dari Instagram",
        "pill": "Chat dengan Dion",
        "group": false
      },
      {
        "t": "in",
        "text": "bro udah gue tf"
      },
      {
        "t": "in",
        "text": "kirim hari ini ya. lama bgt lu dari kemarin"
      },
      {
        "t": "in",
        "text": "resi malam ini atau refund"
      },
      {
        "t": "nar",
        "text": "Sepatu thrift ukuran 42. Harga Rp250.000. Dion menawar sampai tiga kali dan tetap mengeluh."
      },
      {
        "t": "bank",
        "amount": "Rp2.500.000",
        "from": "DION PRATAMA"
      },
      {
        "t": "nar",
        "text": "Kamu membacanya dua kali. Nol-nya kelebihan satu."
      },
      {
        "t": "in",
        "text": "udah masuk kan? jangan bilang belum"
      },
      {
        "t": "nar",
        "text": "Dia tidak sadar. Kos jatuh tempo malam ini. Dan dia menyebalkan."
      },
      {
        "t": "choice",
        "key": "p1",
        "label": "Pilihan 1 dari 2",
        "options": [
          {
            "text": "Pakai dulu buat kos, ganti nanti",
            "go": "pakai",
            "name": "Pakai dulu"
          },
          {
            "text": "Kembalikan semuanya sekarang",
            "go": "balikin",
            "name": "Balikin semua"
          },
          {
            "text": "Kembalikan sebagian, sisanya nanti",
            "go": "sebagian_dulu",
            "name": "Balikin sebagian"
          }
        ]
      }
    ],
    "pakai": [
      {
        "t": "set",
        "v": "dipakai"
      },
      {
        "t": "nar",
        "text": "Kamu mentransfer Rp1.200.000 ke Bu Kos dari uang yang bukan milikmu. Butuh empat detik."
      },
      {
        "t": "view",
        "name": "Bu Kos",
        "initial": "B",
        "sub": "online",
        "pill": "Chat dengan Bu Kos",
        "group": false
      },
      {
        "t": "in",
        "text": "Sudah masuk. Terima kasih Mas Raka, sehat selalu."
      },
      {
        "t": "view",
        "name": "Dion",
        "initial": "D",
        "sub": "online",
        "pill": "Chat dengan Dion",
        "group": false
      },
      {
        "t": "in",
        "text": "resi mana"
      },
      {
        "t": "out",
        "text": "Udah dikirim ya bro",
        "attach": "Foto: resi pengiriman"
      },
      {
        "t": "in",
        "text": "ok"
      },
      {
        "t": "nar",
        "text": "Tidak ada yang sadar. Angka di rekeningmu kembali normal. Kamu yang tidak."
      },
      {
        "t": "nar",
        "text": "02.14. Kamu membuka mutasi rekening untuk ketiga kalinya. Angkanya tidak berubah. Kamu juga tidak tidur."
      },
      {
        "t": "go",
        "to": "minggu"
      }
    ],
    "balikin": [
      {
        "t": "nar",
        "text": "Kamu mentransfer balik Rp2.250.000. Saldo kembali Rp380.000. Rasanya seperti menutup pintu yang anginnya enak."
      },
      {
        "t": "out",
        "text": "Bro, lu kelebihan transfer 2,25 juta. Udah gue balikin, cek ya"
      },
      {
        "t": "in",
        "text": "oh"
      },
      {
        "t": "in",
        "text": "iya salah ketik"
      },
      {
        "t": "in",
        "text": "ok"
      },
      {
        "t": "in",
        "text": "jadi kapan dikirim?"
      },
      {
        "t": "nar",
        "text": "Tidak ada terima kasih. Kamu tidak tahu kenapa kamu mengharapkannya."
      },
      {
        "t": "view",
        "name": "Bu Kos",
        "initial": "B",
        "sub": "online",
        "pill": "Chat dengan Bu Kos",
        "group": false
      },
      {
        "t": "in",
        "text": "Mas Raka, jadi malam ini? Saya juga ada kebutuhan."
      },
      {
        "t": "out",
        "text": "Besok ya Bu. Maaf."
      },
      {
        "t": "nar",
        "text": "Kamu punya Rp380.000 dan satu hari."
      },
      {
        "t": "go",
        "to": "minggu"
      }
    ],
    "sebagian_dulu": [
      {
        "t": "set",
        "v": "sebagian"
      },
      {
        "t": "nar",
        "text": "Kamu mentransfer balik Rp1.000.000. Sisanya, Rp1.250.000, kamu tahan. Kos Rp1.200.000. Hitungannya pas, dan itu yang membuatmu curiga pada dirimu sendiri."
      },
      {
        "t": "out",
        "text": "Bro, lu kelebihan transfer. Gue balikin 1 juta dulu ya, sisanya nyusul"
      },
      {
        "t": "in",
        "text": "sisanya?"
      },
      {
        "t": "in",
        "text": "kelebihan gue 2,25 jt. lu balikin 1 jt doang?"
      },
      {
        "t": "in",
        "text": "lu mau nilep 1,25?"
      },
      {
        "t": "out",
        "text": "Bukan gitu. Kos gue jatuh tempo malam ini, minggu depan gue"
      },
      {
        "t": "in",
        "text": "bukan urusan gue"
      },
      {
        "t": "in",
        "text": "balikin malam ini atau gue post"
      },
      {
        "t": "nar",
        "text": "Kamu membayar kos malam itu juga dengan uangnya. Kalau sudah terlanjur dimarahi, pikirmu, setidaknya kos aman. Logika jam sepuluh malam."
      },
      {
        "t": "nar",
        "text": "Selasa pagi. Di kolom komentar akun jualanmu, satu kalimat dengan huruf kapital semua: PENIPU, kelebihan transfer ga dibalikin full. Sudah dibaca 214 orang."
      },
      {
        "t": "go",
        "to": "minggu"
      }
    ],
    "minggu": [
      {
        "t": "view",
        "name": "Keluarga Yanti",
        "initial": "K",
        "sub": "4 anggota",
        "pill": "Grup Keluarga Yanti",
        "group": true
      },
      {
        "t": "in",
        "text": "Nak jadi dateng kan ibu masak sayur asem sama ikan asin kesukaan kamu jangan telat",
        "from": "Ibu"
      },
      {
        "t": "out",
        "text": "Jadi Bu, otw"
      },
      {
        "t": "in",
        "text": "Mas sudah di jalan. Sarah dan Alya ikut.",
        "from": "Fajar"
      },
      {
        "t": "nar",
        "text": "Minggu, 12.40. Rumah Ibu, Jatiasih. Sayur asem, ikan asin, sambal yang terlalu pedas untuk Alya. Ibu tertawa dua kali dalam lima menit. Kamu menghitungnya, karena belakangan jarang."
      },
      {
        "t": "nar",
        "text": "Fajar duduk di seberangmu. HP-mu bergetar di paha."
      },
      {
        "t": "view",
        "name": "Fajar",
        "initial": "F",
        "sub": "online",
        "pill": "Chat dengan Fajar",
        "group": false
      },
      {
        "t": "in",
        "text": "Dek."
      },
      {
        "t": "in",
        "text": "Kos aman? Jualan gimana?"
      },
      {
        "t": "in",
        "text": "Jangan jawab keras-keras. Ibu lagi dengerin kita."
      },
      {
        "t": "nar",
        "cases": [
          {
            "cond": "dipakai",
            "text": "Kos sudah dibayar. Dengan uang yang bukan milikmu. Fajar tidak tahu. Dion tidak tahu. Hanya kamu, dan sayur asem di piring yang tiba-tiba sulit ditelan."
          },
          {
            "cond": "sebagian",
            "text": "Kos sudah dibayar. Komentar berhuruf kapital itu sudah dibaca 214 orang, dan Fajar punya Instagram."
          },
          {
            "text": "Kos belum dibayar. Bu Kos sudah bertanya dua kali. Kamu mengembalikan Rp2.250.000 ke orang yang bahkan tidak bilang terima kasih, dan sekarang kakakmu bertanya apakah semuanya aman."
          }
        ]
      },
      {
        "t": "choice",
        "key": "p2",
        "label": "Pilihan 2 dari 2",
        "options": [
          {
            "text": "“Aman, Mas.”",
            "go": "akhir_aman",
            "name": "Aman"
          },
          {
            "text": "“Sebenernya… boleh ngomong habis makan?”",
            "go": "akhir_jujur",
            "name": "Sebenernya"
          },
          {
            "text": "“Nanti aja, Mas. Ibu lagi seneng.”",
            "go": "akhir_nanti",
            "name": "Nanti aja"
          }
        ]
      }
    ],
    "akhir_aman": [
      {
        "t": "out",
        "text": "Aman, Mas. Jualan lancar."
      },
      {
        "t": "in",
        "text": "Syukurlah."
      },
      {
        "t": "branch",
        "cases": [
          {
            "cond": "dipakai",
            "to": "aman_dipakai"
          },
          {
            "cond": "sebagian",